{
  "version": 1,
  "id": "track_03",
  "name": "Track 3",
  "centerline": [
    {
      "x": 700,
      "y": 592
    },
    {
      "x": 910,
      "y": 560
    },
    {
      "x": 1080,
      "y": 460
    },
    {
      "x": 1140,
      "y": 300
    },
    {
      "x": 1080,
      "y": 150
    },
    {
      "x": 907.5915221579961,
      "y": 94.65583582727662
    },
    {
      "x": 688.0924855491329,
      "y": 93.42454040188115
    },
    {
      "x": 429.1329479768786,
      "y": 95.88713125267209
    },
    {
      "x": 120.84778420038535,
      "y": 129.13210773834973
    },
    {
      "x": 115.91522157996145,
      "y": 496.05814450619926
    },
    {
      "x": 471.05973025048166,
      "y": 253.492945703292
    },
    {
      "x": 464.89402697495177,
      "y": 578.5549380076957
    },
    {
      "x": 700,
      "y": 592
    }
  ],
  "roadWidth": 150,
  "spawn": {
    "x": 700,
    "y": 592,
    "heading": 0
  },
  "checkpoints": [
    {
      "id": "start_finish",
      "a": {
        "x": 673.2947976878612,
        "y": 675.8272766139377
      },
      "b": {
        "x": 660.9633911368015,
        "y": 518.2214621633177
      }
    },
    {
      "id": "cp_02",
      "a": {
        "x": 319.383429672447,
        "y": 172.2274476271911
      },
      "b": {
        "x": 329.24855491329475,
        "y": 17.084224027362122
      }
    },
    {
      "id": "cp_02",
      "a": {
        "x": 1011.1753371868978,
        "y": 416.02394185549383
      },
      "b": {
        "x": 1120.9248554913295,
        "y": 525.6092347156905
      }
    },
    {
      "id": "cp_03",
      "a": {
        "x": 993.9113680154142,
        "y": 190.69687900812315
      },
      "b": {
        "x": 1059.2678227360307,
        "y": 42.94142796066696
      }
    },
    {
      "id": "cp_04",
      "a": {
        "x": 156.60886319845855,
        "y": 301.5134672937153
      },
      "b": {
        "x": 2.466281310211946,
        "y": 290.43180846515605
      }
    },
    {
      "id": "cp_05",
      "a": {
        "x": 265.1252408477842,
        "y": 510.8336896109449
      },
      "b": {
        "x": 198.53564547206165,
        "y": 349.5339888841385
      }
    },
    {
      "id": "cp_06",
      "a": {
        "x": 385.9730250481695,
        "y": 398.78580589995727
      },
      "b": {
        "x": 547.514450867052,
        "y": 407.40487387772555
      }
    }
  ],
  "style": {
    "grassColor": "#7adcb6",
    "asphaltColor": "#2f3138",
    "borderColor": "#d64545"
  }
}
