{
  "version": 1,
  "id": "track_04",
  "name": "Nahabino",
  "centerline": [
    {
      "x": 1252.9114997185168,
      "y": 256.64445494122606
    },
    {
      "x": 1269.211451075983,
      "y": 1.1914075684200423
    },
    {
      "x": 1059.147772611886,
      "y": -141.14362785881877
    },
    {
      "x": 715.6793595707917,
      "y": 82.1028940026158
    },
    {
      "x": 454.56105018029336,
      "y": -126.3470571716276
    },
    {
      "x": 250.89844995637105,
      "y": -11.723880000192409
    },
    {
      "x": -90.1555869265467,
      "y": -184.46585123038344
    },
    {
      "x": -154.81038064842687,
      "y": -160.2496870392352
    },
    {
      "x": -175.82318860803792,
      "y": -97.28766014224962
    },
    {
      "x": 120.22341889615079,
      "y": 228.58477287583298
    },
    {
      "x": 247.0142496253186,
      "y": 572.778862930977
    },
    {
      "x": 661.4248486835327,
      "y": 494.99742424570735
    },
    {
      "x": 956.6503556928247,
      "y": 246.440934190174
    },
    {
      "x": 1252.9114997185168,
      "y": 256.64445494122606
    }
  ],
  "roadWidth": 107,
  "spawn": {
    "x": 415.20757523207703,
    "y": 583.1571189748907,
    "heading": -0.25
  },
  "checkpoints": [
    {
      "id": "start_finish",
      "a": {
        "x": 390.1591753905847,
        "y": 643.414197375416
      },
      "b": {
        "x": 369.98867160073615,
        "y": 529.2531967878227
      }
    },
    {
      "id": "cp_right",
      "a": {
        "x": 1213.7880801427343,
        "y": 210.27393044013547
      },
      "b": {
        "x": 1289.9877611266065,
        "y": 302.0504211085929
      }
    },
    {
      "id": "cp_top",
      "a": {
        "x": 857.484016282961,
        "y": -75.73654537233075
      },
      "b": {
        "x": 933.5730223489192,
        "y": 8.550806792316973
      }
    },
    {
      "id": "cp_left",
      "a": {
        "x": -113.68838841345118,
        "y": -118.5711013904305
      },
      "b": {
        "x": -200.84488627082146,
        "y": -197.33141406887182
      }
    }
  ],
  "style": {
    "grassColor": "#7adcb6",
    "asphaltColor": "#2f3138",
    "borderColor": "#d64545"
  }
}
