{
  "version": 1,
  "id": "track_02",
  "name": "Octopus",
  "centerline": [
    {
      "x": 996.3776493256262,
      "y": 610.5686190679778
    },
    {
      "x": 1143.1213872832368,
      "y": 549.0038477982043
    },
    {
      "x": 1173.9499036608863,
      "y": 439.41855493800773
    },
    {
      "x": 1127.0905587668592,
      "y": 111.89397178281317
    },
    {
      "x": 947.0520231213873,
      "y": 114.35656263360411
    },
    {
      "x": 911.290944123314,
      "y": 434.49337323642584
    },
    {
      "x": 405.7032755298651,
      "y": 115.58785805899957
    },
    {
      "x": 787.9768786127167,
      "y": 95.88713125267209
    },
    {
      "x": 429.1329479768786,
      "y": 425.87430525865756
    },
    {
      "x": 143.04431599229287,
      "y": 105.73749465583583
    },
    {
      "x": 97.41811175337186,
      "y": 454.19410004275335
    },
    {
      "x": 154.1425818882466,
      "y": 589.6365968362549
    },
    {
      "x": 424.20038535645466,
      "y": 620.4189824711416
    },
    {
      "x": 612.8709055876685,
      "y": 544.0786660966226
    },
    {
      "x": 776.878612716763,
      "y": 616.7250961949551
    }
  ],
  "roadWidth": 130,
  "spawn": {
    "x": 693.0250481695568,
    "y": 626.5754595981189,
    "heading": 0
  },
  "checkpoints": [
    {
      "id": "start_finish",
      "a": {
        "x": 612.8709055876685,
        "y": 617.9563916203506
      },
      "b": {
        "x": 611.6377649325626,
        "y": 480.0513039760582
      }
    },
    {
      "id": "cp_right_top",
      "a": {
        "x": 1187.514450867052,
        "y": 598.2556648140231
      },
      "b": {
        "x": 1083.9306358381502,
        "y": 500.98332620778115
      }
    },
    {
      "id": "cp_02",
      "a": {
        "x": 1043.236994219653,
        "y": 152.52672082086363
      },
      "b": {
        "x": 1054.3352601156068,
        "y": 22.009405728943996
      }
    },
    {
      "id": "cp_03",
      "a": {
        "x": 863.198458574181,
        "y": 356.92176143651136
      },
      "b": {
        "x": 938.4200385356454,
        "y": 494.8268490808038
      }
    },
    {
      "id": "cp_04",
      "a": {
        "x": 574.6435452793834,
        "y": 190.69687900812315
      },
      "b": {
        "x": 463.6608863198458,
        "y": 274.424967935015
      }
    },
    {
      "id": "cp_05",
      "a": {
        "x": 599.3063583815028,
        "y": 140.21376656690893
      },
      "b": {
        "x": 596.8400770712909,
        "y": 17.084224027362122
      }
    },
    {
      "id": "cp_06",
      "a": {
        "x": 653.5645472061657,
        "y": 188.2342881573322
      },
      "b": {
        "x": 755.9152215799614,
        "y": 278.1188542112014
      }
    },
    {
      "id": "cp_07",
      "a": {
        "x": 424.20038535645466,
        "y": 350.765284309534
      },
      "b": {
        "x": 355.1445086705202,
        "y": 466.507054296708
      }
    },
    {
      "id": "cp_08",
      "a": {
        "x": 198.53564547206165,
        "y": 275.65626336041043
      },
      "b": {
        "x": 304.5857418111753,
        "y": 196.85335613510048
      }
    },
    {
      "id": "cp_09",
      "a": {
        "x": 160.30828516377647,
        "y": 345.84010260795213
      },
      "b": {
        "x": 22.196531791907514,
        "y": 347.0713980333476
      }
    },
    {
      "id": "cp_10",
      "a": {
        "x": 308.2851637764932,
        "y": 550.2351432235998
      },
      "b": {
        "x": 291.0211946050096,
        "y": 685.6776400171013
      }
    }
  ],
  "style": {
    "grassColor": "#7adcb6",
    "asphaltColor": "#2f3138",
    "borderColor": "#d64545"
  }
}
