{
    "version":  1,
    "id":  "track_03",
    "name":  "Track 3",
    "centerline":  [
                       {
                           "x":  700,
                           "y":  592
                       },
                       {
                           "x":  910,
                           "y":  560
                       },
                       {
                           "x":  1080,
                           "y":  460
                       },
                       {
                           "x":  1140,
                           "y":  300
                       },
                       {
                           "x":  1080,
                           "y":  150
                       },
                       {
                           "x":  910,
                           "y":  92
                       },
                       {
                           "x":  683.1528964862298,
                           "y":  87.50605837108839
                       },
                       {
                           "x":  336.7141500474834,
                           "y":  92.36118427984405
                       },
                       {
                           "x":  70.50332383665717,
                           "y":  114.20925086924454
                       },
                       {
                           "x":  97.24596391263057,
                           "y":  656.7695711726899
                       },
                       {
                           "x":  455.84045584045583,
                           "y":  265.931935517859
                       },
                       {
                           "x":  478.9363722697056,
                           "y":  664.0522600358233
                       },
                       {
                           "x":  700,
                           "y":  592
                       }
                   ],
    "roadWidth":  150,
    "spawn":  {
                  "x":  700,
                  "y":  592,
                  "heading":  0
              },
    "checkpoints":  [
                        {
                            "id":  "start_finish",
                            "a":  {
                                      "x":  640,
                                      "y":  660
                                  },
                            "b":  {
                                      "x":  640,
                                      "y":  510
                                  }
                        },
                        {
                            "id":  "cp_right",
                            "a":  {
                                      "x":  940,
                                      "y":  346
                                  },
                            "b":  {
                                      "x":  1200,
                                      "y":  346
                                  }
                        },
                        {
                            "id":  "cp_top",
                            "a":  {
                                      "x":  640,
                                      "y":  60
                                  },
                            "b":  {
                                      "x":  640,
                                      "y":  210
                                  }
                        },
                        {
                            "id":  "cp_left",
                            "a":  {
                                      "x":  80,
                                      "y":  346
                                  },
                            "b":  {
                                      "x":  340,
                                      "y":  346
                                  }
                        }
                    ],
    "style":  {
                  "grassColor":  "#7adcb6",
                  "asphaltColor":  "#2f3138",
                  "borderColor":  "#d64545"
              }
}

