{
  "version": 1,
  "id": "track_01",
  "name": "Loop Classic",
  "centerline": [
    {
      "x": 700,
      "y": 592
    },
    {
      "x": 910,
      "y": 560
    },
    {
      "x": 1080,
      "y": 460
    },
    {
      "x": 1140,
      "y": 300
    },
    {
      "x": 1080,
      "y": 150
    },
    {
      "x": 910,
      "y": 92
    },
    {
      "x": 370,
      "y": 92
    },
    {
      "x": 200,
      "y": 150
    },
    {
      "x": 140,
      "y": 300
    },
    {
      "x": 200,
      "y": 460
    },
    {
      "x": 370,
      "y": 560
    },
    {
      "x": 700,
      "y": 592
    }
  ],
  "roadWidth": 150,
  "spawn": {
    "x": 700,
    "y": 592,
    "heading": 0
  },
  "checkpoints": [
    {
      "id": "start_finish",
      "a": {
        "x": 640,
        "y": 660
      },
      "b": {
        "x": 640,
        "y": 510
      }
    },
    {
      "id": "cp_right",
      "a": {
        "x": 1046.6699528109827,
        "y": 343.39995343789394
      },
      "b": {
        "x": 1205.4524127483025,
        "y": 407.16256149128725
      }
    },
    {
      "id": "cp_top",
      "a": {
        "x": 639.3584251456839,
        "y": -4.709420259009838
      },
      "b": {
        "x": 635.9066325383509,
        "y": 157.28207047123252
      }
    },
    {
      "id": "cp_left",
      "a": {
        "x": 59.190751445086704,
        "y": 308.90123984608806
      },
      "b": {
        "x": 223.1984585741811,
        "y": 299.05087644292433
      }
    }
  ],
  "style": {
    "grassColor": "#7adcb6",
    "asphaltColor": "#2f3138",
    "borderColor": "#d64545"
  }
}
